-- simple input
SELECT '120'::lidan;
 lidan 
--------
 120
(1 row)

SELECT '3c'::lidan;
 lidan 
--------
 3c
(1 row)

-- case insensitivity
SELECT '3C'::lidan;
 lidan 
--------
 3c
(1 row)

SELECT 'FoO'::lidan;
 lidan 
--------
 foo
(1 row)

-- invalid characters
SELECT 'foo bar'::lidan;
ERROR:  invalid input syntax for lidan: "foo bar"
LINE 1: SELECT 'foo bar'::lidan;
               ^
SELECT 'abc$%2'::lidan;
ERROR:  invalid input syntax for lidan: "abc$%2"
LINE 1: SELECT 'abc$%2'::lidan;
               ^
-- negative values
SELECT '-10'::lidan;
 lidan 
--------
 -10
(1 row)

-- to big values
SELECT 'abcdefghi'::lidan;
ERROR:  value "abcdefghi" is out of range for type lidan
LINE 1: SELECT 'abcdefghi'::lidan;
               ^
-- storage
BEGIN;
CREATE TABLE lidan_test(val lidan);
INSERT INTO lidan_test VALUES ('123'), ('3c'), ('5A'), ('zZz');
SELECT * FROM lidan_test;
 val 
-----
 123
 3c
 5a
 zzz
(4 rows)

UPDATE lidan_test SET val = '567a' where val = '123';
SELECT * FROM lidan_test;
 val  
------
 3c
 5a
 zzz
 567a
(4 rows)

UPDATE lidan_test SET val = '-aa' where val = '3c';
SELECT * FROM lidan_test;
 val  
------
 5a
 zzz
 567a
 -aa
(4 rows)

ROLLBACK;
